{
  "task_id": "NEXA-0002",
  "title": "Worker safety hardening and audit test suite",
  "objective": "Add safety validator module, safety audit test suite, and enforce strict git isolation without automatic merge",
  "priority": "medium",
  "type": "refactor",
  "complexity": "simple",
  "environment": {
    "server": "nexa-vcn",
    "environment": "development",
    "project_path": "/opt/nexa-chess/NexaGen-dev",
    "branch": "ai/NEXA-0002-worker-safety-hardening-and-au"
  },
  "context": {
    "relevant_files": [],
    "related_models": [],
    "architecture_notes": "NexaGen monorepo dev environment"
  },
  "requirements": [
    "Implement SafetyValidator with realpath traversal checks",
    "Implement command safety policy against prod/destructive commands",
    "Implement automated safety audit suite in .ai/scripts/safety-audit.js"
  ],
  "constraints": [
    "Do not modify production code or configs",
    "Follow existing repository coding patterns and AGENTS.md rules",
    "Must pass verify.sh (typecheck, lint, build, test)"
  ],
  "acceptance_criteria": [
    "Passes all 48 safety audit tests",
    "Worker remains on task branch without merging to dev"
  ],
  "required_tests": [
    "typecheck",
    "lint",
    "build",
    "unit_tests"
  ],
  "safety": {
    "allowed_paths": [
      "/opt/nexa-chess/NexaGen-dev/"
    ],
    "blocked_paths": [
      "/opt/nexa-chess/NexaGen/",
      "/etc/",
      "/var/",
      "/usr/",
      "/root/"
    ],
    "allowed_databases": [
      "vps_dev"
    ],
    "blocked_databases": [
      "nexa_chess",
      "postgres"
    ],
    "requires_approval": false
  },
  "assigned_worker": "nexa-dev-01",
  "provider": "gemini",
  "model": "gemini-2.5-pro",
  "created_at": "2026-08-29T11:27:46.688Z",
  "timeout_minutes": 30
}