{
  "task_id": "NEXA-0001",
  "title": "Add dev environment info helper utility",
  "objective": "Add a safe helper function getDevEnvironmentInfo in packages/utils for diagnostic reporting",
  "priority": "medium",
  "type": "feature_implementation",
  "complexity": "simple",
  "environment": {
    "server": "nexa-vcn",
    "environment": "development",
    "project_path": "/opt/nexa-chess/NexaGen-dev",
    "branch": "ai/NEXA-0001-add-dev-environment-info-helpe"
  },
  "context": {
    "relevant_files": [],
    "related_models": [],
    "architecture_notes": "NexaGen monorepo dev environment"
  },
  "requirements": [
    "Implement getDevEnvironmentInfo in packages/utils/src/dev-info.ts",
    "Export getDevEnvironmentInfo from packages/utils/src/index.ts"
  ],
  "constraints": [
    "Do not modify production code or configs",
    "Follow existing repository coding patterns and AGENTS.md rules",
    "Must pass verify.sh (typecheck, lint, build, test)"
  ],
  "acceptance_criteria": [
    "getDevEnvironmentInfo returns platform and nodeEnv object",
    "Passes all verification checks (typecheck, lint, build, test)"
  ],
  "required_tests": [
    "typecheck",
    "lint",
    "build",
    "unit_tests"
  ],
  "safety": {
    "allowed_paths": [
      "/opt/nexa-chess/NexaGen-dev/"
    ],
    "blocked_paths": [
      "/opt/nexa-chess/NexaGen/",
      "/etc/",
      "/var/",
      "/usr/",
      "/root/"
    ],
    "allowed_databases": [
      "vps_dev"
    ],
    "blocked_databases": [
      "nexa_chess",
      "postgres"
    ],
    "requires_approval": false
  },
  "assigned_worker": "nexa-dev-01",
  "provider": "gemini",
  "model": "gemini-2.5-pro",
  "created_at": "2026-08-29T11:16:32.095Z",
  "timeout_minutes": 30
}